읍면,설치위치,설치기구종류,설치년도,고장현황,담당부서,데이터기준일자
홍동면,충청남도 홍성군 홍동면 신기리 564-6,"상체근육풀기, 허리돌리기, 양팔로프당기기, 싸이클+하늘걷기",2016,양호,교육체육과,2022-09-30
홍동면,충청남도 홍성군 홍동면 광금북로17번길 47,"하늘걷기, 달리기, 두팔노젓기, 활차머신, 파도타기",2016,양호,교육체육과,2022-09-30
홍동면,충청남도 홍성군 홍동면 충절로501번길 58,"큰활차머신, 옆파도타기, 하늘걷기, 두팔노젓기, 달리기",2017,양호,교육체육과,2022-09-30
홍동면,충청남도 홍성군 홍동면 광금북로114번길 59-29,"달리기, 하늘걷기, 두팔노젓기, 옆파도타기, 큰활차머신",2016,양호,교육체육과,2022-09-30
홍동면,충청남도 홍성군 홍동면 광금북로114번길 144,"허리돌리기, 큰활차머신, 역기올리기, 공중걷기, 팔다리밀기",2017,양호,교육체육과,2022-09-30
홍동면,충청남도 홍성군 홍동면 광금북로114번길 248-31,"상체근육풀기, 허리돌리기, 양팔로프당기기, 싸이클+하늘걷기",2016,양호,교육체육과,2022-09-30
홍동면,충청남도 홍성군 홍동면 금당리 688-1,"달리기+허리돌리기, 하늘걷기+작은활차, 등허리지압기",2016,양호,교육체육과,2022-09-30
홍동면,충청남도 홍성군 홍동면 금당리 385-5,"허리돌리기+오금펴기, 어깨유연성운동, 싸이클+하늘걷기, 물결타기",2016,양호,교육체육과,2022-09-30
홍동면,충청남도 홍성군 홍동면 금당리 508-1,"허리돌리기, 역기내리기+오금펴기, 싸이클+어깨유연성, 물결타기",2018,양호,교육체육과,2022-09-30
홍동면,충청남도 홍성군 홍동면 효학리 238,"허리돌리기, 역기내리기+오금펴기, 달리기+어깨유연성, 하늘걷기+등허리지압기",2017,양호,교육체육과,2022-09-30
홍동면,충청남도 홍성군 홍동면 효학리 161-1,"달리기+옆파도타기, 하늘걷기+활차돌리기, 허리돌리기+등지압하기, 다리뻗기+줄당기기",2016,양호,교육체육과,2022-09-30
홍동면,충청남도 홍성군 홍동면 대영리 193-3,"물결타기+상체근육풀기, 하늘걷기+등허리지압기, 허리돌리기+어깨유연성, 오금펴기+양팔줄당기기",2017,양호,교육체육과,2022-09-30
홍동면,충청남도 홍성군 홍동면 대영리 51-1,"허리돌리기+하늘걷기, 등허리지압기+옆파도타기, 다리밀기+역기내리기, 양팔줄다리기+큰활차",2018,양호,교육체육과,2022-09-30
홍동면,충청남도 홍성군 홍동면 금당리 243-9,"역기내리기+오금펴기, 싸이클+어깨유연성, 물결타기, 허리돌리기+달리기",2019,양호,교육체육과,2022-09-30
홍동면,충청남도 홍성군 홍동면 팔괘리 287-1,"써핑롤링+트위스트, 스윙워커+오버헤드폴리머신, 싣업머신+레그프레스 머신, 로라맛사지+위킹트레이너머신",2019,양호,교육체육과,2022-09-30
장곡면,충청남도 홍성군 장곡면 홍남동로650번길 66,"하늘걷기, 파도타기, 상체근육풀기",2015,양호,교육체육과,2022-09-30
장곡면,충청남도 홍성군 장곡면 장곡길416번길 21,하늘걷기+자전거,2016,양호,교육체육과,2022-09-30
장곡면,충청남도 홍성군 장곡면 홍장남로144번길 144,"오금펴기+자전거, 달리기+허리돌리기, 물결타기+하늘걷기",2016,양호,교육체육과,2022-09-30
장곡면,충청남도 홍성군 장곡면 장곡318번길 163/ 장곡길434번길 102-3,"하늘걷기+어깨유연성, 파도타기+상체근육풀기, 마사지기+허리돌리기",2016,양호,교육체육과,2022-09-30
장곡면,충청남도 홍성군 장곡면 오성1길 30,"달리기+허리돌리기, 하늘걷기+작은활차, 등허리지압기",2016,양호,교육체육과,2022-09-30
장곡면,충청남도 홍성군 장곡면 장곡길 717-20,"상체풀기+양팔로프당기기, 하늘걷기+싸이클, 물결타기+역기올리기, 허리돌리기+오금펴기",2016,양호,교육체육과,2022-09-30
장곡면,충청남도 홍성군 장곡면 무한로 987,"달리기+허리돌리기, 하늘걷기+작은활차, 등허리지압기",2017,양호,교육체육과,2022-09-30
장곡면,충청남도 홍성군 장곡면 장곡동길 277,"워킹트렝이너+트위스트, 체스트업머신+큰활차머신, 체스트풀머신+디핑머신, 써핑롤링머신+트위스트머신",2017,양호,교육체육과,2022-09-30
장곡면,충청남도 홍성군 장곡면 홍장남로101번길 48,"윗몸일으키기+허리돌리기, 역기내리기+오금펴기, 2단철봉, 달리기",2017,양호,교육체육과,2022-09-30
장곡면,충청남도 홍성군 장곡면 홍장남로272번길 58-34,"역기내리기+오금펴기, 달리기+어깨유연성운동, 싸이클+허리돌리기, 하늘걷기",2017,양호,교육체육과,2022-09-30
장곡면,충청남도 홍성군 장곡면 무한로1181번길 35-4,"하늘걷기+윗몸일으키기, 하늘걷기+물결타기, 상체근육풀기+양팔줄당기기",2017,양호,교육체육과,2022-09-30
장곡면,충청남도 홍성군 장곡면  홍남동로713번길 190,"하늘걷기+노젓기, 허리돌리기+등허리지압기, 물결타기+상체근육풀기, 오금펴기+양팔줄당기기",2017,양호,교육체육과,2022-09-30
장곡면,충청남도 홍성군 장곡면 장곡길 520-4,"하늘걷기+노젓기, 허리돌리기+등허리지압기, 물결타기+상체근육풀기, 오금펴기+역기올리기",2017,양호,교육체육과,2022-09-30
장곡면,충청남도 홍성군 장곡면 장곡길534번길 49,"하늘걷기+철봉, 허리돌리기+달리기, 물결타기+상체근육풀기, 오금펴기+양팔줄당기기",2017,양호,교육체육과,2022-09-30
장곡면,충청남도 홍성군 장곡면 무한로 1043-24,"허리돌리기, 역기내릭기+오금펴기, 달리기+어깨유연성, 파도타기+등지압기",2017,양호,교육체육과,2022-09-30
장곡면,충청남도 홍성군 장곡면 무한로749번길 66,"어깨유연성운동+하늘걷기, 등허리지압기+허리돌리기, 상체근육풀기+물결타기, 양팔줄당기기+오금펴기",2017,양호,교육체육과,2022-09-30
장곡면,충청남도 홍성군 장곡면 홍남동로357번길 15-1,"체스트업머신+큰활자머신, 스윙워커머신+오버헤드풀리머신, 써핑롤링머신+트위스트머신, 싣업머신+레그프레스머신",2017,양호,교육체육과,2022-09-30
장곡면,충청남도 홍성군 장곡면 홍남동로357번길 223,"옆파도타기+옆허리돌리기, 하늘걷기+큰활차돌리기, 큰활차돌리기+양팔줄당기기, 작은활차돌리기+다리밀기",2018,양호,교육체육과,2022-09-30
장곡면,충청남도 홍성군 장곡면 홍남동로474번길 120-1,"역기내리기+오금펴기, 하늘걷기+등허리지압기, 싸이클+허리돌리기, 상체근육풀기",2018,양호,교육체육과,2022-09-30
장곡면,충청남도 홍성군 장곡면 무한로 1379,"공중걷기+어깨풀기, 윗몸일으키기+파도타기, 양팔당기기+상체풀기, 허리돌리기+달리기",2018,양호,교육체육과,2022-09-30
장곡면,충청남도 홍성군 장곡면 장곡길92번길 22,"옆파도타기+등허리지압, 하늘걷기+양팔줄당기기, 큰활차돌리기+작은활차돌리기, 허리돌리기+다리밀기",2018,양호,교육체육과,2022-09-30
장곡면,충청남도 홍성군 장곡면 홍남동로352번길 14,"공중걷기+어깨풀기, 등지압기+허리돌리기, 양팔당기기+상체풀기, 다리뻗치기+파도타기",2018,양호,교육체육과,2022-09-30
장곡면,충청남도 홍성군 장곡면 장곡동길 97,"하늘걷기+등지압, 옆파도타기+양팔줄당기기, 허리돌리기+큰활차돌리기, 역기내리기+다리밀기",2018,양호,교육체육과,2022-09-30
장곡면,충청남도 홍성군 장곡면 상송리 62,"상체풀기+철봉, 물결타기+오금펴기, 어깨풀기+허리돌리기, 하늘걷기+공중걷기",2018,양호,교육체육과,2022-09-30
장곡면,충청남도 홍성군 장곡면 화계리 568-45,"옆파도타기+허리돌리기, 하늘걷기+등허리지압기, 큰활차돌리기+양팔줄당기기, 다리밀기+역기내리기",2018,양호,교육체육과,2022-09-30
은하면,충청남도 홍성군 은하면 은하로129번길 298,하늘걷기,2015,양호,교육체육과,2022-09-30
은하면,충청남도 홍성군 은하면 은하로129번길 174,"큰활차돌리기, 거꾸로매달리기, 허리돌리기, 양팔줄당기기",2015,양호,교육체육과,2022-09-30
은하면,충청남도 홍성군 은하면 홍남로192번길 60,"허리돌리기, 물결타기, 오금펴기, 하늘걷기",2016,양호,교육체육과,2022-09-30
은하면,충청남도 홍성군 은하면 목현리 478-4외 1,"달리기운동+좌우파도타기, 윗몸일으키기+다리뻗기, 등지압+허리돌리기, 활차돌리기+걷기운동",2016,양호,교육체육과,2022-09-30
은하면,충청남도 홍성군 은하면 대판리 127-69,"달리기+옆파도, 걷기+활차, 뻗기+줄당기기, 허리돌리기+등지압",2016,양호,교육체육과,2022-09-30
은하면,충청남도 홍성군 은하면 홍남로229번길 30,"하늘뻗기, 다리뻗치기, 큰활차머신",2016,양호,교육체육과,2022-09-30
은하면,충청남도 홍성군 은하면 홍남도231번길 115,"줄당기기+오금펴기, 물결타기+역기올리기, 허리돌리기+싸이클, 달리기",2017,양호,교육체육과,2022-09-30
은하면,충청남도 홍성군 은하면 금국리 357,"달리기, 줄당기기, 물결타기, 허리돌리기",2017,양호,교육체육과,2022-09-30
은하면,충청남도 홍성군 은하면 은하로406번길 11,"다리뻗치기, 활차, 하늘걷기, 줄당기기",2017,양호,교육체육과,2022-09-30
은하면,충청남도 홍성군 은하면 은하로129번길 76,"파도타기, 등허리지압기, 허리돌리기, 달리기, 역기내리기",2017,양호,교육체육과,2022-09-30
은하면,충청남도 홍성군 은하면 은하로406번길 156,"허리돌리기, 하늘걷기, 등허리지압기, 역기내리기",2017,양호,교육체육과,2022-09-30
은하면,충청남도 홍성군 은하면 구성남서310번길 1580-4,"물결타기, 양팔줄당기기",2017,양호,교육체육과,2022-09-30
은하면,충청남도 홍성군 은하면 은하로81번길 35,"허리돌리기, 파도타기, 거꾸로매달리기, 역기내리기, 하늘걷기",2018,양호,교육체육과,2022-09-30
은하면,충청남도 홍성군 은하면 은하로404번길 91,"역기내리기, 하늘걷기, 허리돌리기, 상체근육풀기",2018,양호,교육체육과,2022-09-30
은하면,충청남도 홍성군 은하면 은하로560번길 17,"역기내리기, 하늘걷기, 허리돌리기, 상체근육풀기",2018,양호,교육체육과,2022-09-30
은하면,충청남도 홍성군 은하면 홍남로22번길 131-89,"큰활차돌리기, 거꾸로매달리기, 허리돌리기, 양팔줄당기기",2018,양호,교육체육과,2022-09-30
은하면,충청남도 홍성군 은하면 홍남로229번길 198,"허리돌리기+하늘걷기, 옆파도타기+옆파도타기, 다리밀기+양팔줄당기기, 작은활차돌리기+큰활차돌리기",2019,양호,교육체육과,2022-09-30
결성면,충청남도 홍성군 결성면 백야로138번길 6,"허리돌리기, 윗몸일으키기, 역기올리기+물결타기, 싸이클+달리기, 상체근육풀기",2014,양호,교육체육과,2022-09-30
결성면,충청남도 홍성군 결성면 만해로435번길 53-4,"상체근육풀기, 허리돌리기, 싸이클+하늘걷기, 물결타기, 오금펴기, 달리기",2015,양호,교육체육과,2022-09-30
결성면,충청남도 홍성군 결성면 형산1길 22,"상체근육풀기, 허리돌리기, 역기내리기+오금펴기",2015,양호,교육체육과,2022-09-30
결성면,충청남도 홍성군 결성면 홍남서로843번길 160,"상체근육풀기, 허리돌리기, 싸이클+하늘걷기, 물결타기, 오금펴기, 달리기",2015,양호,교육체육과,2022-09-30
결성면,충청남도 홍성군 결성면 구성남로 27,"상체근육풀기, 허리돌리기, 싸이클+하늘걷기, 물결타기, 오금펴기, 달리기",2016,양호,교육체육과,2022-09-30
결성면,충청남도 홍성군 결성면 산업로248번길 5,"역기내리기, 물결타기, 노젓기, 양팔로드당기기",2015,양호,교육체육과,2022-09-30
결성면,충청남도 홍성군 결성면 구성남로 55,"2단철봉, 오금펴기, 역기내리기, 싸이클+역기올리기",2016,양호,교육체육과,2022-09-30
결성면,충청남도 홍성군 결성면 만해로14번길 115,"상체근육풀기, 허리돌리기, 오금펴기, 하늘걷기, 물결타기",2016,양호,교육체육과,2022-09-30
결성면,충청남도 홍성군 결성면 구성남로219번길 18,"상체근육풀기, 허리돌리기, 오금펴기, 하늘걷기, 물결타기",2016,양호,교육체육과,2022-09-30
결성면,충청남도 홍성군 결성면 만해로 169-36,오금펴기,2016,양호,교육체육과,2022-09-30
결성면,충청남도 홍성군 결성면 성남길29번길 150,"상체근육풀기, 허리돌리기, 오금펴기, 싸이클+하늘걷기, 물결타기",2016,양호,교육체육과,2022-09-30
결성면,충청남도 홍성군 결성면 와룡로174번길 13,"상체근육풀기, 허리돌리기, 오금펴기, 하늘걷기, 물결타기",2016,양호,교육체육과,2022-09-30
결성면,충청남도 홍성군 결성면 용호리 507-23,"싸이클+하늘걷기, 윗몸일으키기+허리돌리기, 노젓기+어깨유연성운동, 오금펴기",2016,양호,교육체육과,2022-09-30
결성면,충청남도 홍성군 결성면 만해로115번길 36,"싸이클+하늘걷기, 윗몸일으키기+허리돌리기, 노젓기+어깨유연성운동, 오금펴기",2016,양호,교육체육과,2022-09-30
결성면,충청남도 홍성군 결성면 만해로230번길 97,"체스트업+큰활차머신, 싣업머신+레그프레스, 워킹트레이너머신+트위스트머신",2017,양호,교육체육과,2022-09-30
결성면,충청남도 홍성군 결성면 만해로230번길 97,스윙워커+작은활차머신,2017,양호,교육체육과,2022-09-30
결성면,충청남도 홍성군 결성면 산업로248번길 5,"거꾸러머신, 치닝머신",2017,양호,교육체육과,2022-09-30
결성면,충청남도 홍성군 결성면 성남길 119,"윗몸일으키기+허리돌리기, 역기내리기+오금펴기, 달리기+어깨유연성운동, 하늘걷기",2017,양호,교육체육과,2022-09-30
결성면,충청남도 홍성군 결성면 산업로 388,"윗몸일으키기+허리돌리기, 역기내리기+오금펴기, 달리기+어깨유연성운동, 물결타기+등지압기",2017,양호,교육체육과,2022-09-30
결성면,충청남도 홍성군 결성면 만해로497번길 46,"체스트업머신+큰활차머신, 스윙워커+오버해드풀리, 써핑롤머신+트위스트머신, 싣업머신+레그프레스머신",2017,양호,교육체육과,2022-09-30
결성면,충청남도 홍성군 결성면 성호길 233번길 6,"써핑롤링+오버헤드머신, 스윙워커+작은활차머신, 로윙라이더+트위스트머신, 체스트풀+디핑머신",2018,양호,교육체육과,2022-09-30
결성면,충청남도 홍성군 결성면 홍남서로817번길 55,"상체근육풀기+양팔로프, 윗몸일으키기+허리돌리기, 역기내리기+오금펴기, 하늘걷기+등허리지압기",2018,양호,교육체육과,2022-09-30
결성면,충청남도 홍성군 결성면 홍남서로510번길 146-31,"상체근육풀기+양팔로프, 윗몸일으키기+허리돌리기, 역기내리기+오금펴기, 하늘걷기+등허리지압기",2018,양호,교육체육과,2022-09-30
결성면,충청남도 홍성군 결성면 성호길 43,"상체근육풀기+양팔로프, 싸이클+허리돌리기, 역기내리기+오금펴기, 하늘걷기+등허리지압기",2018,양호,교육체육과,2022-09-30
결성면,충청남도 홍성군 결성면 읍내리 570-5,"허리돌리기+허리돌리기, 옆파도타기+옆파도타기, 하늘걷기+양팔줄당기기, 작은활차돌리기+큰활차돌리기",2019,양호,교육체육과,2022-09-30
서부면,충청남도 홍성군 서부면 남당리 859-2,"달리기, 싸이클+하늘걷기, 상체근육풀기",2015,양호,교육체육과,2022-09-30
서부면,충청남도 홍성군 서부면 상호길5번길 6-1,"역기내리기+올리기, 달리기+하늘걷기, 활차+허리돌리기, 옆파도타기+등허리지압기",2015,양호,교육체육과,2022-09-30
서부면,충청남도 홍성군 서부면 홍보로 1525,"등허리지압기+허리돌리기, 큰활차돌리기+하늘걷기, 양팔줄당기기+다리뻗치기, 달리기+옆파도타기",2016,양호,교육체육과,2022-09-30
서부면,충청남도 홍성군 서부면 서부로 194,"등허리지압기+허리돌리기, 큰활차돌리기+하늘걷기, 양팔줄당기기+다리뻗치기, 달리기+옆파도타기",2017,양호,교육체육과,2022-09-30
서부면,충청남도 홍성군 서부면 홍남서로375번길 9,"하늘걷기, 양팔로프당기기, 싸이클+달리기",2017,양호,교육체육과,2022-09-30
서부면,충청남도 홍성군 서부면 홍남서로285번길 20,"달리기+활차, 옆파도타기+허리, 하늘걷기+다리뻗치기, 역기올리기+줄당기기",2017,양호,교육체육과,2022-09-30
서부면,충청남도 홍성군 서부면 와룔로72번길 102,"옆파도+줄당기기, 달리기+활차, 허리돌리기+하늘걷기, 다리뻗치기+등허리지압기",2017,양호,교육체육과,2022-09-30
서부면,충청남도 홍성군 서부면 남당항로 689,"옆파도+하늘걷기, 달리기+활차, 허리돌리기+다리뻗치기, 역기올리기+줄당기기",2017,양호,교육체육과,2022-09-30
서부면,충청남도 홍성군 서부면 남당항로140번길 61-26,"옆파도+줄당기기, 달리기+활차, 허리돌리기+하늘걷기, 다리뻗치기+등허리지압기",2017,양호,교육체육과,2022-09-30
서부면,충청남도 홍성군 서부면 임해로 315,"하늘걷기, 양팔로프당기기, 싸이클+달리기",2017,양호,교육체육과,2022-09-30
서부면,충청남도 홍성군 서부면 거차1길 10,"하늘걷기, 허리돌리기, 역기내리기+오금펴기, 물결타기+상체근육펴기",2017,양호,교육체육과,2022-09-30
서부면,충청남도 홍성군 서부면 서부서길 183,"싸이클, 달리기",2017,양호,교육체육과,2022-09-30
서부면,충청남도 홍성군 서부면 광리 188-3,"허리돌리기, 큰활차, 달리기",,양호,교육체육과,2022-09-30
서부면,충청남도 홍성군 서부면 궁리 521-6,"하늘걷기+허리돌리기, 양팔줄당기기+다리밀기, 큰활차+옆파도타기, 등허리지압기+달리기운동",2018,양호,교육체육과,2022-09-30
서부면,충청남도 홍성군 서부면 광리 385-11,"옆파도타기+옆파도타기, 큰활차머신+작은활차머신, 양팔줄당기기+다리밀기, 하늘걷기+허리돌리기",2019,양호,교육체육과,2022-09-30
갈산면,충청남도 홍성군 갈산면 갈산서길55번길 17-1,"윗몸일으키기, 하늘걷기, 오금펴기, 달리기, 허리돌리기",2012,양호,교육체육과,2022-09-30
갈산면,충청남도 홍성군 갈산면 동성리 355-8,"오금펴기, 핸들웨이트",2012,양호,교육체육과,2022-09-30
갈산면,충청남도 홍성군 갈산면 취생리 97-1,"허리돌리기+하늘걷기, 달리기+옆파도타기, 등허리지압기+큰활차돌리기",2015,양호,교육체육과,2022-09-30
갈산면,충청남도 홍성군 갈산면 동성리 39-1,"허리돌리기, 하늘걷기, 노젓기, 등허리지압기",2015,양호,교육체육과,2022-09-30
갈산면,충청남도 홍성군 갈산면 부기리 819,"허리돌리기+파도타기, 허리돌리기+노젓기, 하늘걷기+양팔줄당기기, 역기올리기+큰활차돌리기",2015,양호,교육체육과,2022-09-30
갈산면,충청남도 홍성군 갈산면 백야로 347번길 88,"큰활차, 허리돌리기, 거꾸로서기",2016,양호,교육체육과,2022-09-30
갈산면,충청남도 홍성군 갈산면 수덕사로317번길 131,"등허리지압기+허리돌리기, 양팔줄당기기+오금펴기, 옆파도타기+달리기, 하늘걷기+큰활차돌리기",2016,양호,교육체육과,2022-09-30
갈산면,충청남도 홍성군 갈산면 기산리 196-1,"달리기+등지압기, 큰활차돌리기+역기들기, 하늘걷기+양팔줄당기기, 옆파도타기",2016,양호,교육체육과,2022-09-30
갈산면,충청남도 홍성군 갈산면 운곡2길 14,"허리돌리기+윗몸일으키기, 역기내리기+오금펴기, 하늘걷기+작은활차돌리기, 달리기+허리돌리기",2016,양호,교육체육과,2022-09-30
갈산면,충청남도 홍성군 갈산면 내포로 1628-11,"허리돌리기+오금펴기, 큰활차돌리기+역기들기",2016,양호,교육체육과,2022-09-30
갈산면,충청남도 홍성군 갈산면 수덕사로324번길 56,"작은활차돌리기+하늘걷기, 옆파도타기+양팔줄당기기",2016,양호,교육체육과,2022-09-30
갈산면,충청남도 홍성군 갈산면 기산리 35-8,"하늘걷기+자전거타기, 허리돌리기+윗몸일으키기, 달리기+작은활차돌리기",2016,양호,교육체육과,2022-09-30
갈산면,충청남도 홍성군 갈산면 백야로314번길 57,"윗몸일으키기+허리돌리기, 역기내리기+오금펴기",2016,양호,교육체육과,2022-09-30
갈산면,충청남도 홍성군 갈산면 백야로 390,"큰활차돌리기+역기들기, 오금펴기+허리돌리기",2016,양호,교육체육과,2022-09-30
갈산면,충청남도 홍성군 갈산면 부기리 93,"거꾸로매달리기, 작은활차돌리기+등허리지압기, 하늘걷기+허리돌리기, 옆파도타기+양팔줄당기기",2017,양호,교육체육과,2022-09-30
갈산면,충청남도 홍성군 갈산면 동산1길 3,"큰활차돌리기+하늘걷기, 오금펴기+파도타기, 양팔줄당기기+역기내리기, 달리기+허리돌리기",2017,양호,교육체육과,2022-09-30
갈산면,충청남도 홍성군 갈산면 내갈리 499,"자전거타기+허리돌리기, 오금펴기+역기내리기, 하늘걷기+작은활차돌리기",2017,양호,교육체육과,2022-09-30
갈산면,충청남도 홍성군 갈산면 쌍천리 349,"오금펴기+역기내리기, 허리돌리기+자전거타기",2017,양호,교육체육과,2022-09-30
갈산면,충청남도 홍성군 갈산면 가곡리 380-1,"거꾸로서기, 허리돌리기+양팔줄당기기, 큰활차돌리기+옆파도타기, 하늘걷기+오금펴기",2017,양호,교육체육과,2022-09-30
갈산면,충청남도 홍성군 갈산면 갈오리 43,"등허리지압기+하늘걷기, 허리돌리기+양팔줄당기기, 큰활차돌리기+옆파도타기",2017,양호,교육체육과,2022-09-30
갈산면,충청남도 홍성군 갈산면 갈산로150번길 84-9,"옆파도타기+허리돌리기, 하늘걷기+큰활차돌리기, 등허리지압기+양팔중당기기, 작은활차돌리기+달리기",2018,양호,교육체육과,2022-09-30
갈산면,충청남도 홍성군 갈산면 내포로1390번길 99,"큰활차돌리기+허리돌리기, 하늘걷기+양팔줄당기기, 등지압기+옆파도타기",2018,양호,교육체육과,2022-09-30
갈산면,충청남도 홍성군 갈산면 가곡리 81-1,"하늘걷기+허리돌리기, 양팔줄당기기+다리밀기, 큰활차돌리기+옆파도타기, 등허리지압기+역기내리기",2018,양호,교육체육과,2022-09-30
갈산면,충청남도 홍성군 갈산면 부기리 93,"파도타기, 윗몸일으키기, 오금펴기, 달리기, 하늘걷기, 작은활차돌리기, 역기올리기, 허리돌리기",2017,양호,교육체육과,2022-09-30
갈산면,충청남도 홍성군 갈산면 부기리 201-2,허리돌리기+큰활차돌리기,2019,양호,교육체육과,2022-09-30
갈산면,충청남도 홍성군 갈산면 대사1길 52,"허리돌리기, 싸이클+노젓기",2019,양호,교육체육과,2022-09-30
갈산면,충청남도 홍성군 갈산면 갈산로121번길 8,"옆파도타기+허리돌리기, 하늘걷기+큰활차돌리기, 등허리지압+양팔줄당기기,작은활차돌리기+다리밀기",2019,양호,교육체육과,2022-09-30
구항면,충청남도 홍성군 구항면 지정리 897,"큰력강화머신, 달리기, 공중걷기, 윗몸일으키기, 등허리지압기",2012,양호,교육체육과,2022-09-30
구항면,충청남도 홍성군 구항면 장양리 602-3,"양팔로프당기기, 역기올리기, 물결타기",2015,양호,교육체육과,2022-09-30
구항면,충청남도 홍성군 구항면 내현리 516-6,"로라맛사지머신, 워킹트레이너머신, 트위스트머신, 거꾸리머신",2015,양호,교육체육과,2022-09-30
구항면,충청남도 홍성군 구항면 내현리 210-7,"체스트프레스머신, 로라맛사지머신, 스윙워커머신, 더블트위스트",2015,양호,교육체육과,2022-09-30
구항면,충청남도 홍성군 구항면 신곡리 674,"로라맛사지머신, 트위스트머신, 작은활차머신, 오버헤드풀리머신, 스윙워커머신",2016,양호,교육체육과,2022-09-30
구항면,충청남도 홍성군 구항면 남산리 123-1,"물결타기, 노젓기운동, 양팔로프당기기, 역기내리기+오금펴기",2016,양호,교육체육과,2022-09-30
구항면,충청남도 홍성군 구항면 신곡리 690,"달리기+옆파도, 하늘걷기+활차돌리기, 허리돌리기+등지압, 다리뻗기+줄당기기",2016,양호,교육체육과,2022-09-30
