읍면,설치위치,설치기구종류,설치년도,고장현황,담당부서,데이터기준일자
홍성읍,충청남도 홍성군 홍성읍 조양로103번길 27-6,"큰활차머신, 자유철봉",2016,양호,교육체육과,2022-09-30
홍성읍,충청남도 홍성군 홍성읍 조양로 143번길 35-12,"양팔줄당기기+양팔줄당기기, 허리돌리기+싸이클",2016,양호,교육체육과,2022-09-30
홍성읍,충청남도 홍성군 홍성읍 조양로 33번길 20-18,"역기올리기+큰활차머신, 허리돌리기+옆파도타기, 양팔줄당기기+하늘걷기",2015,양호,교육체육과,2022-09-30
홍성읍,충청남도 홍성군 홍성읍 조양로75번길 26-3,"다리뻗치기+옆파도타기, 허리돌리기+큰활차머신, 달리기+하늘걷기",,양호,교육체육과,2022-09-30
홍성읍,충청남도 홍성군 홍성읍 홍장북로475번길 25-18,"등허리지압기+하늘걷기, 작은활차머신+노젓기, 윗몸일으키기+허리돌리기, 옆파도타기+옆파도타기 ",2016,양호,교육체육과,2022-09-30
홍성읍,충청남도 홍성군 홍성읍 충절로1032번길 34-5,"양팔작은활차+달리기, 싸이클+달리기, 다리뻗치기+역기내리기",2016,양호,교육체육과,2022-09-30
홍성읍,충청남도 홍성군 홍성읍 홍성천길 하천변 우체국앞,"허리돌리기+허리돌리기, 옆파도타기+옆파도타기, 하늘걷기+하늘걷기, 큰활차머신+큰활차머신",,양호,교육체육과,2022-09-30
홍성읍,충청남도 홍성군 홍성읍 하천변 권용타운 앞,"양팔줄당기기+허리돌리기, 옆파도타기+하늘걷기, 자유철봉+윗몸일으키기, 등허리지압기+큰활차머신",2017,양호,교육체육과,2022-09-30
홍성읍,충청남도 홍성군 홍성읍 월계천길 41-11,"등허리지압기+하늘걷기, 작은활차머신+노젓기, 윗몸일으키기+허리돌리기, 옆파도타기+옆파도타기 ",,양호,교육체육과,2022-09-30
홍성읍,충청남도 홍성군 홍성읍 월계천길 41-11,"두팔노젓기+두팔노젓기, 달리기+달리기, 하늘걷기+하늘걷기, 등허리지압기+등허리지압기, 옆파도타기+옆파도타기, 윗몸일으키기+윗몸일으키기",2016,양호,교육체육과,2022-09-30
홍성읍,충청남도 홍성군 홍성읍 충서로 1506 홍성우체국 앞 공원,"옆파도타기+허리돌리기, 하늘걷기+다리뻗치기, 큰활차머신+달리기",,양호,교육체육과,2022-09-30
홍성읍,충청남도 홍성군 홍성읍 충서로 1506 세광아파트,"양팔로프당기기+윗몸일으키기, 허리돌리기+하늘걷기, 역기내리기+두팔노젓기, 큰활차머신+다리뻗치기, 옆파도타기+자유철봉",2016,양호,교육체육과,2022-09-30
홍성읍,충청남도 홍성군 홍성읍 충서로1575번길 100,"하늘걷기+하늘걷기, 양팔줄당기기+양팔줄당기기, 큰활차머신+큰활차머신, 옆파도타기+옆파도타기",2016,양호,교육체육과,2022-09-30
홍성읍,충청남도 홍성군 홍성읍 간동1길 64-2,"옆파도타기+옆파도타기, 역기내리기+역기내리기, 노젓기+노젓기, 양팔줄당기기+양팔줄당기기",2017,양호,교육체육과,2022-09-30
홍성읍,충청남도 홍성군 홍성읍 충서로1707번길 366-2,"허리돌리기+양팔줄당기기, 등허리지압기+큰활차머신, 허리돌리기+하늘걷기, 옆파도타기+달리기, 역기올리기+역기내리기, 거꾸로매달리기",2017,양호,교육체육과,2022-09-30
홍성읍,충청남도 홍성군 홍성읍 의사로57번길 14-1,"역기올리기+양팔줄당기기, 옆파도타기+하늘걷기, 달리기+큰활차머신, 허리돌리기+다리뻗치기",2016,양호,교육체육과,2022-09-30
홍성읍,충청남도 홍성군 홍성읍 소향길 76-7,"허리돌리기+허리돌리기, 큰활차머신+큰활차머신, 싸이클+싸이클, 다리뻗치기+다리뻗치기",2016,양호,교육체육과,2022-09-30
홍성읍,충청남도 홍성군 홍성읍 청기2길 2,"큰활차머신+큰활차머신, 역기내리기+다리뻗치기, 옆파도타기+옆파도타기, 싸이클+허리돌리기",2016,양호,교육체육과,2022-09-30
홍성읍,충청남도 홍성군 홍성읍 월계1길 80,"허리돌리기+하늘걷기, 옆파도타기+달리기, 등허리지압기+큰활차머신",,양호,교육체육과,2022-09-30
홍성읍,충청남도 홍성군 홍성읍 백월로117번길 77,"역기올리기+다리뻗치기, 양팔줄당기기+허리돌리기",2017,양호,교육체육과,2022-09-30
홍성읍,충청남도 홍성군 홍성읍 월산로30번길 39,"옆파도타기+옆파도타기, 달리기+달리기, 하늘걷기+하늘걷기, 노젓기+노젓기, 옆파도타기+옆파도타기, 다리뻗치기+다리뻗치기, 하늘걷기+하늘걷기, 옆파도타기+옆파도타기, 큰활차머신+큰활차머신, 허리돌리기+허리돌리기, 등허리지압기+등허리지압기","2016, 2017",양호,교육체육과,2022-09-30
홍성읍,충청남도 홍성군 홍성읍 내포로251번길 120,"하늘걷기+등허리지압기, 옆파도타기+윗몸일으키기, 허리돌리기+큰활차머신, 역기내리기",2017,양호,교육체육과,2022-09-30
홍성읍,충청남도 홍성군 홍성읍 충서로1301번길 9-32,"달리기+등허리지압기, 양팔중당기기+하늘걷기, 옆파도타기+허리돌리기, 역기올리기+큰활차머신",,양호,교육체육과,2022-09-30
홍성읍,충청남도 홍성군 홍성읍 옥암리 1105 코오롱아파트,"큰활차머신+달리기, 허리돌리기+등허리지압기, 하늘걷기+노젓기, 옆파도타기+역기내리기",2016,양호,교육체육과,2022-09-30
홍성읍,충청남도 홍성군 홍성읍 충서로1159번길 18-5,"하늘걷기+하늘걷기, 양팔줄당기기+양팔줄당기기, 역기내리기+역기내리기, 큰활차머신+큰활차머신, 허리돌리기+허리돌리기",2016,양호,교육체육과,2022-09-30
홍성읍,충청남도 홍성군 홍성읍 남장중로 63-19,"역기올리기+역기내리기, 허리돌리기+허리돌리기, 옆파도타기+다리뻗치기, 윗몸일으키기+윗몸일으키기, 큰활차머신+작은활차머신, 허리돌리기+허리돌리기, 큰활차머신+큰활차머신, 달리기+달리기, 하늘걷기+하늘걷기, 평행봉운동+평행봉운동",,양호,교육체육과,2022-09-30
홍성읍,충청남도 홍성군 홍성읍 남장중로 63-19,"큰활차머신+큰활차머신, 옆파도타기+옆파도타기, 하늘걷기+하늘걷기, 하늘걷기+하늘걷기",2014,양호,교육체육과,2022-09-30
홍성읍,충청남도 홍성군 홍성읍 홍장북로441번길 17,"하늘걷기+하늘걷기, 다리뻗치기+다리뻗치기, 역기내리기+역기내리기, 옆파도타기+옆파도타기, 허리돌리기+허리돌리기, 평행봉운동+평행봉운동, 큰활차머신+큰활차머신, 거꾸로매달기",,양호,교육체육과,2022-09-30
홍성읍,충청남도 홍성군 홍성읍 문화로72번길 92,"허리돌리기+하늘걷기, 옆파도타기+등허리지압기, 역기올리기+큰활차머신, 싸이클+달리기, 옆파도타기+허리돌리기, 다리뻗치기+다리뻗치기, 역기내리기+역기올리기, 윗몸일으키기+윗몸일으키기, 큰활차머신+큰활차머신, 등허리지압기+허리지압기, 하늘걷기+옆파도타기",2017,양호,교육체육과,2022-09-30
홍성읍,충청남도 홍성군 홍성읍 문화로72번길 92,"옆파도타기+옆파도타기, 다리뻗치기+다리뻗치기, 싸이클+하늘걷기, 이단철봉+이단철봉",2017,양호,교육체육과,2022-09-30
홍성읍,충청남도 홍성군 홍성읍 대학길 211-9,"하늘걷기+허리돌리기, 역기내리기+등허리지압기, 역기올리기+옆파도타기, 큰활차머신+작은활차머신",2017,양호,교육체육과,2022-09-30
홍성읍,충청남도 홍성군 홍성읍 남학길 27,"큰활차머신+옆파도타기, 하늘걷기+등허리지압기, 양팔줄당기기+허리돌리기",2017,양호,교육체육과,2022-09-30
홍성읍,충청남도 홍성군 홍성읍 홍장북로237번길 154,"작은활차+큰활차머신, 허리돌리기+다리뻗치기",2018,양호,교육체육과,2022-09-30
홍성읍,충청남도 홍성군 홍성읍 충절로903번길 48,"허리돌리기+큰활차머신, 양팔줄당기기+하늘걷기, 달리기+등허리지압기, 옆파도타기+다리뻗치기",,양호,교육체육과,2022-09-30
홍성읍,충청남도 홍성군 홍성읍 충절로1005-9,"하늘걷기+하늘걷기, 역기내리기+역기내리기, 달리기+달리기, 허리돌리기+허리돌리기, 옆파도타기+옆파도타기",2016,양호,교육체육과,2022-09-30
홍성읍,충청남도 홍성군 홍성읍 충절로873번길 64-9,"허리돌리기+허리돌리기, 옆파도타기+옆파도타기, 다리뻗치기+역기내리기, 하늘걷기+하늘걷기",,양호,교육체육과,2022-09-30
홍성읍,충청남도 홍성군 홍성읍 대내길 177,"달리기, 허리돌리기+허리돌리기+허리돌리기",,양호,교육체육과,2022-09-30
홍성읍,충청남도 홍성군 홍성읍 대내길 177,"양팔줄당기기+옆파도타기, 다리뻗치기+역기올리기, 하늘걷기+허리돌리기, 큰활차머신+달리기",2017,양호,교육체육과,2022-09-30
홍성읍,충청남도 홍성군 홍성읍 충서로1707번길 90,"다리뻗치기+양팔줄당기기, 등허리지압기+허리돌리기, 하늘걷기+큰활차머신, 옆파도타기+달리기",2016,양호,교육체육과,2022-09-30
홍성읍,충청남도 홍성군 홍성읍 충절로810번길 18,"큰활차머신+하늘걷기, 옆파도타기+달리기, 양팔줄당기기+다리뻗치기, 허리돌리기+등허리지압기",2016,양호,교육체육과,2022-09-30
홍성읍,충청남도 홍성군 홍성읍 충절로818번길 108,"큰활차머신+허리돌리기, 옆파도타기+달리기",,양호,교육체육과,2022-09-30
홍성읍,충청남도 홍성군 홍성읍 송월리 홍장북로140번길 6,"상체근육풀기, 윗몸일으키기+허리돌리기, 역기내리기+오금펴기, 하늘걷기+등허리지압기",2019,양호,교육체육과,2022-09-30
홍성읍,충청남도 홍성군 홍성읍 대학길 61,"온몸틀어올리기+온몸역기기내리기, 옆파도타기+싸이클, 하늘걷기+하늘걷기",2019,양호,교육체육과,2022-09-30
홍성읍,충청남도 홍성군 홍성읍 남장2리 이안아파트,"온몸들어올리기+온몸역기내리기, 옆파도타기+싸이클, 하늘걷기+하늘걷기",2019,양호,교육체육과,2022-09-30
홍성읍,충청남도 홍성군 홍성읍 남장4리 주공1차아파트,"역기내리기+오금펴기, 허리돌리기",2019,양호,교육체육과,2022-09-30
광천읍,충청남도 홍성군 광천읍 오서길351번길 8-10,"공중걷기, 파도타기, 허리돌리기, 상체근육풀기",2014,양호,교육체육과,2022-09-30
광천읍,충청남도 홍성군 광천읍 광천리 30-6,"공중걷기, 파도타기, 허리돌리기, 상체근육풀기",2015,양호,교육체육과,2022-09-30
광천읍,충청남도 홍성군 광천읍 오서길351번길 8-3,"허리돌리기, 공중걷기, 역기내리기",2015,양호,교육체육과,2022-09-30
광천읍,충청남도 홍성군 광천읍 홍남동로183번길 124,"공중걷기, 파도타기, 허리돌리기, 상체근육풀기",2015,양호,교육체육과,2022-09-30
광천읍,충청남도 홍성군 광천읍 상정리 744-2,"공중걷기, 파도타기, 허리돌리기, 상체근육풀기",2016,양호,교육체육과,2022-09-30
광천읍,충청남도 홍성군 광천읍 홍남로 854,"공중걷기, 파도타기, 허리돌리기, 상체근육풀기",2016,양호,교육체육과,2022-09-30
광천읍,충청남도 홍성군 광천읍 홍남동로 147-4,"공중걷기, 허리돌리기",2016,양호,교육체육과,2022-09-30
광천읍,충청남도 홍성군 광천읍 충서로317번길 39,"공중걷기, 파도타기, 허리돌리기",2016,양호,교육체육과,2022-09-30
광천읍,충청남도 홍성군 광천읍 홍남로617번길 18,"공중걷기, 파도타기, 허리돌리기",2017,양호,교육체육과,2022-09-30
광천읍,충청남도 홍성군 광천읍 광천로386번길 10,"공중걷기, 파도타기, 허리돌리기",2017,양호,교육체육과,2022-09-30
광천읍,충청남도 홍성군 광천읍 가정길 124-16,"공중걷기, 파도타기, 허리돌리기",2017,양호,교육체육과,2022-09-30
광천읍,충청남도 홍성군 광천읍 홍남로632번길 36,"공중걷기, 파도타기, 허리돌리기",2017,양호,교육체육과,2022-09-30
광천읍,충청남도 홍성군 광천읍 담산리 882-13,허리돌리기,2017,양호,교육체육과,2022-09-30
광천읍,충청남도 홍성군 광천읍 충서로469번길 50-3,"공중걷기, 파도타기, 허리돌리기, 상체근육풀기",2017,양호,교육체육과,2022-09-30
광천읍,충청남도 홍성군 광천읍 옹암1길 31,"공중걷기, 파도타기, 허리돌리기, 상체근육풀기",2017,양호,교육체육과,2022-09-30
광천읍,충청남도 홍성군 광천읍 내죽1길 25-7,"파도타기, 허리돌리기, 상체근육풀기",2017,양호,교육체육과,2022-09-30
광천읍,충청남도 홍성군 광천읍 벽계1길 84,"공중걷기, 파도타기, 허리돌리기, 상체근육풀기",2017,양호,교육체육과,2022-09-30
광천읍,충청남도 홍성군 광천읍 오서길54번길 53,"상체근육풀기, 파도타기, 역기내리기, 공중걷기",2017,양호,교육체육과,2022-09-30
광천읍,충청남도 홍성군 광천읍 충서로545번길 74-17,"공중걷기, 파도타기, 허리돌리기",2017,양호,교육체육과,2022-09-30
광천읍,충청남도 홍성군 광천읍 광천로359번길 32-9,"공중걷기, 파도타기, 허리돌리기",2017,양호,교육체육과,2022-09-30
광천읍,충청남도 홍성군 광천읍 홍남동로126번길 70,"공중걷기, 파도타기, 허리돌리기, 상체근육풀기",2017,양호,교육체육과,2022-09-30
광천읍,충청남도 홍성군 광천읍 홍남로744번길 14,"공중걷기, 파도타기, 허리돌리기, 상체근육풀기, 허리돌리기",2018,양호,교육체육과,2022-09-30
광천읍,충청남도 홍성군 광천읍 홍남로687번길 67-1,"공중걷기, 파도타기, 허리돌리기, 상체근육풀기",2018,양호,교육체육과,2022-09-30
광천읍,충청남도 홍성군 광천읍 월림1길 20-4,"공중걷기, 파도타기, 허리돌리기, 상체근육풀기",2018,양호,교육체육과,2022-09-30
광천읍,충청남도 홍성군 광천읍 광금남로63번길 175,"공중걷기, 파도타기, 허리돌리기, 상체근육풀기",2018,양호,교육체육과,2022-09-30
광천읍,충청남도 홍성군 광천읍 담산길 13,"윗몸일으키기, 어깨근육풀기",2018,양호,교육체육과,2022-09-30
광천읍,충청남도 홍성군 광천읍 광금남로123번길 16,"공중걷기, 파도타기, 허리돌리기, 상체근육풀기",2018,양호,교육체육과,2022-09-30
광천읍,충청남도 홍성군 광천읍 상정리 744-2,"윗몸일으키기, 어깨근육풀기",2018,양호,교육체육과,2022-09-30
광천읍,충청남도 홍성군 광천읍 광천로386번길 10,"공중걷기, 파도타기, 허리돌리기, 상체근육풀기",2018,양호,교육체육과,2022-09-30
광천읍,충청남도 홍성군 광천읍 오서길62번길 45,"공중걷기, 파도타기, 허리돌리기, 상체근육풀기",2018,양호,교육체육과,2022-09-30
광천읍,충청남도 홍성군 광천읍 충서로523번길 27-24,"공중걷기, 파도타기, 허리돌리기, 상체근육풀기",2018,양호,교육체육과,2022-09-30
광천읍,충청남도 홍성군 광천읍 매현1길 2,"노젓기+허리돌리기, 파도타기+달리기, 허리지압기+윗몸일으키기, 공중걷기+작은활차",2019,양호,교육체육과,2022-09-30
광천읍,충청남도 홍성군 광천읍 담산길 13,"공중걷기+작은활차, 자전거+허리돌리기",2019,양호,교육체육과,2022-09-30
홍북읍,충청남도 홍성군 홍북읍 석택리 387-13,"입식트위스트, 트윈워밍망, 롤링웨이스트",2016,양호,교육체육과,2022-09-30
홍북읍,충청남도 홍성군 홍북읍 내덕리 591-2,"오금펴기, 윗몸일으키기+허리돌리기",2016,양호,교육체육과,2022-09-30
홍북읍,충청남도 홍성군 홍북읍 내덕리 91-2,"상체근육풀기+철봉, 에어워커",2017,양호,교육체육과,2022-09-30
홍북읍,충청남도 홍성군 홍북읍 상하리 564-18,"윗몸일으키기+허리돌리기, 하늘걷기+등허리지압기, 달리기+어깨유연성운동, 상체근육풀기",2017,양호,교육체육과,2022-09-30
홍북읍,충청남도 홍성군 홍북읍 신경리 1204,하늘걷기,2018,양호,교육체육과,2022-09-30
홍북읍,충청남도 홍성군 홍북읍 봉신리 57-15,"허리돌리기, 옆파도타기+싸이클, 크로스컨트리+하늘걷기, 상체근육풀기",2018,양호,교육체육과,2022-09-30
홍북읍,충청남도 홍성군 홍북읍 대인리 287,"크로스컨트리+하늘걷기, 다리쭉뻗치기+허리돌리기, 온몸스텝밟기",2018,양호,교육체육과,2022-09-30
홍북읍,충청남도 홍성군 홍북읍 신경리 1369,"온몸역기내리기, 어깨근육풀기, 온몸스텝밟기, 옆파도타기+싸이클",2018,양호,교육체육과,2022-09-30
홍북읍,충청남도 홍성군 홍북읍 내덕리 52-1,"옆파도타기+싸이클, 어깨근육풀기+상체근육풀기, 다리쭉뻗치기+허리돌리기, 양팔줄당기기",2018,양호,교육체육과,2022-09-30
홍북읍,충청남도 홍성군 홍북읍 중계리 205-7,"상체근육풀기, 파도타기, 공중걷기, 윗몸일으키기, 온몸노젓기, 어깨근육풀기, 크로스컨트리 허리돌리기",,양호,교육체육과,2022-09-30
홍북읍,충청남도 홍성군 홍북읍 중계리 742-4,"공중걷기, 파도타기 허리돌리기, 어깨근육풀기",,양호,교육체육과,2022-09-30
홍북읍,충청남도 홍성군 홍북읍 용산리 133-7,"양팔줄당기기, 크로스컨트리, 풀웨이트, 워밍암, 트윈트위스트, 롤링웨이스트",,양호,교육체육과,2022-09-30
홍북읍,충청남도 홍성군 홍북읍 신정리 19-1,"원그리기, 허리돌리기, 가로하늘타기",,양호,교육체육과,2022-09-30
홍북읍,충청남도 홍성군 홍북읍 봉신리 266-46,"온몸역기내리기, 온몸노젓기, 하늘걷기",,양호,교육체육과,2022-09-30
홍북읍,충청남도 홍성군 홍북읍 상하리 174-6,"상체근육풀기, 파도타기, 크로스컨트리+공중걷기",,양호,교육체육과,2022-09-30
홍북읍,충청남도 홍성군 홍북읍 내용길 270,"하늘걷기, 허리돌리기, 양팔로프당기기, 달리기+허리돌리기",2019,양호,교육체육과,2022-09-30
금마면,충청남도 홍성군 금마면 봉수산로676번길 2-31,"허리돌리기, 달리기+윗몸일으키기, 등허리지압기+옆파도타기",2008,양호,교육체육과,2022-09-30
금마면,충청남도 홍성군 금마면 죽림리 산 43,"하늘걷기, 오금펴기, 달리기운동, 팔뻗치기, 허리돌리기, 큰활차머신, 윗몸일으키기, 옆파도타기",2014,양호,교육체육과,2022-09-30
금마면,충청남도 홍성군 금마면 덕정리 782,"허리돌리기+하늘걷기, 등허리지압기+큰활차머신, 달리기+옆파도타기",2015,양호,교육체육과,2022-09-30
금마면,충청남도 홍성군 금마면 봉수산로418번길 91,"달리기+옆파도타기, 허리돌리기+하늘걷기, 다리뻗치기+양팔줄당기기, 큰활차머신+등허리지압기",2016,양호,교육체육과,2022-09-30
금마면,충청남도 홍성군 금마면 부평리 25-5,"옆파도타기+달리기, 하늘걷기+큰활차머신, 등허리지압기+허리돌리기, 다리뻗치기+양팔줄당기기",2016,양호,교육체육과,2022-09-30
금마면,충청남도 홍성군 금마면 홍양길 518,"양팔줄당기기+다리뻗치기, 옆파도타기+달리기운동, 허리돌리기+하늘걷기, 큰활차머신+등허리지압기",2016,양호,교육체육과,2022-09-30
금마면,충청남도 홍성군 금마면 홍양길 311-11,"양팔줄당기기+다리뻗치기, 등허리지압기+허리돌리기, 달리기+옆파토타기, 큰활차머신+ 하늘걷기",2016,양호,교육체육과,2022-09-30
금마면,충청남도 홍성군 금마면 충서로1910번길 29,"하늘걷기+허리돌리기, 등허리지압기+큰활차머신, 양팔줄당기기+다리뻗치기, 옆파도타기+달리기",2016,양호,교육체육과,2022-09-30
금마면,충청남도 홍성군 금마면 금마로26번길 16,"등허리지압기+활차머신, 양팔줄다리기+다리뻗치기, 허리돌리기+하늘걷기, 달리기+옆파도타기",2016,양호,교육체육과,2022-09-30
금마면,충청남도 홍성군 금마면 금마로436번길 29,"역기내리기+솔라오금펴기, 어깨유연성운동+달리기, 공중걷기, 허리돌리기+윗몸일으키기",2017,양호,교육체육과,2022-09-30
금마면,충청남도 홍성군 금마면 홍양길79번길 29,"노젓기+하늘걷기, 물결타기+상체근육풀기, 양팔로프당기기+허리돌리기",2017,양호,교육체육과,2022-09-30
금마면,충청남도 홍성군 금마면 금북로126번길 70,"허리돌리기, 물결타기, 솔라오금펴기, 어깨유연성운동",2017,양호,교육체육과,2022-09-30
금마면,충청남도 홍성군 금마면 가산리 213-1,"역기올리기+역기내리기, 파도타기+상체근육풀기, 허리돌리기+달리기, 상체근육풀기+허리돌리기",2018,양호,교육체육과,2022-09-30
금마면,충청남도 홍성군 금마면 덕정리 249,"다리밀기+달리기, 옆파도타기+하늘걷기, 허리돌리기, 양팔줄당기기, 등허리지압기+큰활차머신",2019,양호,교육체육과,2022-09-30
홍동면,충청남도 홍성군 홍동면 홍장남로582번길 10,"하늘걷기+등허리지압기, 허리돌리기+어깨유연성, 물결타기+상체근육풀기, 오금펴기+양풀줄당기기",2017,양호,교육체육과,2022-09-30
홍동면,충청남도 홍성군 홍동면 광금남로572번길 11,"체스트업머신, 다리구르기, 허리돌리기, 가슴운동",2015,양호,교육체육과,2022-09-30
홍동면,충청남도 홍성군 홍동면 월현3길 115,"하늘걷기+등허리지압기, 허리돌리기+어깨유연성, 물결타기+상체근육풀기, 오금펴기+양풀줄당기기",2017,양호,교육체육과,2022-09-30
홍동면,충청남도 홍성군 홍동면 월현2길 21,"역기올리기+물결타기, 달리기, 싸이클+허리돌리기, 오금펴기+양팔줄다리기",2017,양호,교육체육과,2022-09-30
홍동면,충청남도 홍성군 홍동면 원천1길 61,"상체근육풀기+양팔로프, 물결타기+평행봉, 허리돌리기+어깨유연성, 하체근육풀기+등허리지업기",2017,양호,교육체육과,2022-09-30
홍동면,충청남도 홍성군 홍동면 충서로726번길 347-17,"큰활차+작은활차, 등허리지압기, 공중걷기, 양풀줄당기기+허리돌리기",2018,양호,교육체육과,2022-09-30
홍동면,충청남도 홍성군 홍동면 광금남로446번길 61,"허리돌리기+마사지기, 오금펴기+양팔줄당기기, 어깨유연성+하늘걷기, 물결타기+상체근육풀기",2016,양호,교육체육과,2022-09-30
홍동면,충청남도 홍성군 홍동면 홍남동로183번길 326,"달리기+옆파도, 하늘걷기+활차돌리기, 등지압+허리돌리기, 다리뻗기+줄당기기",2016,양호,교육체육과,2022-09-30
홍동면,충청남도 홍성군 홍동면 홍원리 245-1,"오금펴기+물결타기, 하늘걷기+상체풀기, 체스트풀+싯업",2016,양호,교육체육과,2022-09-30
홍동면,충청남도 홍성군 홍동면 광금남로498번길 89,"물결타기+상체근육풀기, 하늘걷기+등허리지압기, 허리돌리기+어깨유연성, 오금펴기+양팔줄당기기",2017,양호,교육체육과,2022-09-30
홍동면,충청남도 홍성군 홍동면 홍남동로183번길398,"크로스컨츄리+하늘걷기, 옆파도타기+싸이클",2018,양호,교육체육과,2022-09-30
홍동면,충청남도 홍성군 홍동면 문당길 142,"윗몸일으키기+허리돌리기, 역기올리기+물결타기, 싸이클+하늘걷기, 오금펴기",2016,양호,교육체육과,2022-09-30
홍동면,충청남도 홍성군 홍동면 문당리 757,"등허리지압기+윗몸일으키기, 어깨유연성+양팔줄당기기, 허리돌리기+노젓기, 물결타기+상체근육풀기",2016,양호,교육체육과,2022-09-30
홍동면,충청남도 홍성군 홍동면 금평1길 69,"공중걷기+달리기, 옆파도타기+큰활차",2018,양호,교육체육과,2022-09-30
홍동면,충청남도 홍성군 홍동면 홍동길 197,"써핑롤링머신, 워킹트레이너머신, 큰활차머신, 레그프레스",,양호,교육체육과,2022-09-30
홍동면,충청남도 홍성군 홍동면 홍동길 66,"싸이클+달리기, 오금펴기+줄당기기, 하늘걷기+허리돌리기, 파도타기+등허리지압기",2017,양호,교육체육과,2022-09-30
홍동면,충청남도 홍성군 홍동면 광금남로 787-13,"어깨유연성+달리기, 상체풀기+물결타기, 허리돌리기+마사지기, 양팔로프+오금펴기",2016,양호,교육체육과,2022-09-30
홍동면,충청남도 홍성군 홍동면 광금남로699번길 58,"허리돌리기, 어깨스트레칭, 활차돌리기",2013,양호,교육체육과,2022-09-30
홍동면,충청남도 홍성군 홍동면 팔괘리 876,"달리기+활차돌리기, 옆파도타기+허리돌리기, 하늘걷기+다리뻗치기, 등지압+줄당기기",2017,양호,교육체육과,2022-09-30
홍동면,충청남도 홍성군 홍동면 광금남로572번길 11,"오금펴기, 공중걷기, 노젓기, 허리돌리기",2014,양호,교육체육과,2022-09-30
