읍면,설치위치,설치기구종류,설치년도,고장현황,담당부서,데이터기준일자
구항면,충청남도 홍성군 구항면 내현리 64-2,"양팔줄당기기+등허리지압기, 옆파도타기+허리돌리기, 다리뻗치기+하늘걷기, 큰활차머신+달리기운동",2016,양호,교육체육과,2022-09-30
구항면,충청남도 홍성군 구항면 청광리 460-2,"써핑롤링머신, 허리돌리기, 스윙워커머신, 체스트풀머신, 싣업머신",2016,양호,교육체육과,2022-09-30
구항면,충청남도 홍성군 구항면 마온리 197-1,"싣업머신+써핑롤링머신, 스윙워커머신+오버해드풀리머신, 레그프레스머신+트위스트머신, 체스트업머신+큰활차머신",2016,양호,교육체육과,2022-09-30
구항면,충청남도 홍성군 구항면 장양리 604-4,"하늘걷기, 물결타기, 허리돌리기",2017,양호,교육체육과,2022-09-30
구항면,충청남도 홍성군 구항면 오봉리 658-1,"윗몸일으키기+허리돌리기, 역기내리기+오금펴기, 달리기+어깨유연성운동, 물결타기+등지압기",2017,양호,교육체육과,2022-09-30
구항면,충청남도 홍성군 구항면 마온리 5-10,"하늘걷기+물결타기, 싸이클+허리돌리기, 역기내리기+오금펴기, 달리기",2018,양호,교육체육과,2022-09-30
구항면,충청남도 홍성군 구항면 지정리 469-2,"허리돌리기+양팔줄당기기, 등허리지압+헐리돌리기, 옆파도타기+작은활차돌리기, 양팔줄당기기+두팔노젓기, 달리기+하늘걷기, 큰활차돌리기+다리밀기",2018,양호,교육체육과,2022-09-30
구항면,충청남도 홍성군 구항면 공리저수지,"옆파도타기+하늘걷기, 허리돌리기+양팔줄당기기, 큰활차돌리기+등허리지압기",2019,양호,교육체육과,2022-09-30
구항면,충청남도 홍성군 구항면 마온아파트,허리돌리기+양팔줄당기기,2019,양호,교육체육과,2022-09-30
